{"version":2,"name":"synthetic-filter","provider":"custom","seeds":[{"id":"filter","request":{"model":"fake","state":{"channel":"web"},"questions":{"filter":{"type":"noul","instructions":"Allow this item?"}}},"mutations":{"builtin":true}}],"contracts":[{"id":"filter-id","question":"filter","projection":"noul","mutations":["question_id_rename"]}],"budget":{"logicalRequests":30,"httpAttempts":0,"wallTimeSeconds":20,"discoveryRequests":6,"confirmationRequests":24,"shrinkRequests":0,"finalConfirmationRequests":0}}
