{"version":2,"name":"synthetic-risk-score","provider":"custom","seeds":[{"id":"risk","request":{"model":"fake","state":{"optional":"x"},"questions":{"risk":{"type":"score","instructions":"Assign risk.","criteria":["low","high"]}}},"mutations":{"builtin":true}}],"contracts":[{"id":"risk-id","question":"risk","projection":"score","mutations":["question_id_rename"]}],"budget":{"logicalRequests":30,"httpAttempts":0,"wallTimeSeconds":20,"discoveryRequests":6,"confirmationRequests":24,"shrinkRequests":0,"finalConfirmationRequests":0}}
